{
  "schema_version": "0.1.0",
  "eval_id": "regression-for-meeting-deletion-drift-会议删除漂移回归用例",
  "generated_at": "2026-03-20T18:50:32+00:00",
  "title": "Regression for meeting deletion drift 会议删除漂移回归用例",
  "origin": "debug-pack:meeting-deletion-drift-会议删除漂移",
  "command": "python -m unittest",
  "reproduction_steps": [
    "删除会议列表中的第二条会议"
  ],
  "assertions": [
    "只能删除目标会议，其他会议必须保持不变"
  ],
  "tags": [
    "bugfix",
    "meeting",
    "delete"
  ]
}
