{
  "schema_version": "0.1.0",
  "eval_id": "regression-for-bootstrap-import-order",
  "generated_at": "2026-03-18T05:08:54+00:00",
  "title": "Regression for bootstrap import order",
  "origin": "debug-pack:cli-import-failure-on-fresh-setup",
  "command": "python -m unittest discover -s tests -v",
  "reproduction_steps": [
    "Install the package before running tests."
  ],
  "assertions": [
    "The test suite imports aidrp successfully."
  ],
  "tags": [
    "bootstrap",
    "unittest"
  ]
}
